Table Description,Table Name,Name,Name clean,Description,Description clean,'Type / Format',Last Updated,Last Updated date,File Name,Comments,Length,Values,Example
stores contract cycle information.,BU50T1_DT_CONTRACT_CYCLES,CREATED_BY,CreatedBy,Created by Userid,Created by Userid,NUMBER,2013-05-07 00:54:46,2013-05-07T00:54:46Z,CREATED_BY_17838,NULL,22.0,NULL,NULL
stores information regarding the contract cycle steps.,BU50T1_DT_CYCLE_SETUPS,CREATED_BY,CreatedBy,Created by Userid,Created by Userid,NUMBER,2013-05-07 00:54:46,2013-05-07T00:54:46Z,CREATED_BY_17852,NULL,22.0,NULL,NULL
"contains lookup values that are used by the other BU50T1_DT"" tables.""",BU50T1_DT_LOOKUPS,CREATED_BY,CreatedBy,Created by Userid,Created by Userid,NUMBER,2013-05-07 00:54:46,2013-05-07T00:54:46Z,CREATED_BY_17865,NULL,22.0,NULL,NULL
Contains all CPM facility information.,BU50T1_FACILITIES,CREATED_BY,CreatedBy,Created by Userid,Created by Userid,VARCHAR2,2013-05-07 00:54:46,2013-05-07T00:54:46Z,CREATED_BY_17878,NULL,250.0,NULL,NULL
Table not used,BU50T1_FAQ,CREATED_BY,CreatedBy,Created by Userid,Created by Userid,VARCHAR2,2013-05-07 00:54:46,2013-05-07T00:54:46Z,CREATED_BY_17893,NULL,250.0,NULL,NULL
Table not used.,BU50T1_FAQ_CATEGORIES,CREATED_BY,CreatedBy,Created by Userid,Created by Userid,VARCHAR2,2013-05-07 00:54:46,2013-05-07T00:54:46Z,CREATED_BY_17902,NULL,250.0,NULL,NULL
Contains expenditure information sent from the FMPS system.,BU50T1_FMPS_EXPENDITURES,CREATED_BY,CreatedBy,Created by Userid,Created by Userid,VARCHAR2,2013-05-07 00:54:46,2013-05-07T00:54:46Z,CREATED_BY_17926,NULL,250.0,NULL,NULL
Table not used.,BU50T1_FMPS_EXPENDITURE_DETAIL,CREATED_BY,CreatedBy,Created by Userid,Created by Userid,VARCHAR2,2013-05-07 00:54:46,2013-05-07T00:54:46Z,CREATED_BY_17944,NULL,250.0,NULL,NULL
Contains funding strip information recieved from FMPS.,BU50T1_FMPS_FUNDING_STRIPS,CREATED_BY,CreatedBy,Created by Userid,Created by Userid,VARCHAR2,2013-05-07 00:54:46,2013-05-07T00:54:46Z,CREATED_BY_17960,NULL,250.0,NULL,NULL
Contains all the funding accounts as listed in the legacy CIP system.  This table is no longer used.,BU50T1_FUNDING_ACCTS,CREATED_BY,CreatedBy,Created by Userid,Created by Userid,VARCHAR2,2013-05-07 00:54:46,2013-05-07T00:54:46Z,CREATED_BY_17974,NULL,250.0,NULL,NULL
Contains the funding process as listed in the legacy CIP system.  This table is no longer used.,BU50T1_FUNDING_PROCESS,CREATED_BY,CreatedBy,Created by Userid,Created by Userid,VARCHAR2,2013-05-07 00:54:46,2013-05-07T00:54:46Z,CREATED_BY_17980,NULL,250.0,NULL,NULL
contains the funding source as listed in the legacy CIP system.  This table is no longer used.,BU50T1_FUNDING_SOURCE,CREATED_BY,CreatedBy,Created by Userid,Created by Userid,VARCHAR2,2013-05-07 00:54:46,2013-05-07T00:54:46Z,CREATED_BY_17992,NULL,250.0,NULL,NULL
Contains all fund codes in the CPM system.,BU50T1_FUNDS,CREATED_BY,CreatedBy,Created by Userid,Created by Userid,VARCHAR2,2013-05-07 00:54:46,2013-05-07T00:54:46Z,CREATED_BY_18004,NULL,250.0,NULL,NULL
Contains the geocoding results for an address/location.,BU50T1_GEO_RESULTS,CREATED_BY,CreatedBy,Created by Userid,Created by Userid,VARCHAR2,2013-05-07 00:54:47,2013-05-07T00:54:47Z,CREATED_BY_18031,NULL,250.0,NULL,NULL
Contains all valid geocode shapes/geographies that are available for CPM use.,BU50T1_GEO_SHAPES,CREATED_BY,CreatedBy,Created by Userid,Created by Userid,VARCHAR2,2013-05-07 00:54:47,2013-05-07T00:54:47Z,CREATED_BY_18045,NULL,250.0,NULL,NULL
Contains all units of measurement of work types contained in CPM.,BU50T1_MEASURE_TYPES,CREATED_BY,CreatedBy,Created by Userid,Created by Userid,VARCHAR2,2013-05-07 00:54:47,2013-05-07T00:54:47Z,CREATED_BY_18055,NULL,250.0,NULL,NULL
This table contains all the records (menu address_work_types) that we load into cpm from the menu spreadsheets that BOE and CDOT send to us.  Note that the addresses_temp table only contains the data from the current spreadsheet.,BU50T1_MENU_ADDR_WORK_TYPES_JN,CREATED_BY,CreatedBy,Created by Userid,Created by Userid,VARCHAR2,2013-05-07 00:54:47,2013-05-07T00:54:47Z,CREATED_BY_18069,NULL,250.0,user,NULL
Contains the list of CIP users that should have had access to CPM for the initial go-live.  This table is no longer used.,BU50T1_PERSONNEL,CREATED_BY,CreatedBy,Created by Userid,Created by Userid,VARCHAR2,2013-05-07 00:54:47,2013-05-07T00:54:47Z,CREATED_BY_18101,NULL,250.0,NULL,NULL
Table contains no data.,BU50T1_PRJ_FND_STRPS_ORIG_LOAD,CREATED_BY,CreatedBy,Created by Userid,Created by Userid,VARCHAR2,2013-05-07 00:54:47,2013-05-07T00:54:47Z,CREATED_BY_18145,NULL,250.0,NULL,NULL
Table contains the Programs which assigned to projects.,BU50T1_PROGRAMS,CREATED_BY,CreatedBy,Created by Userid,Created by Userid,VARCHAR2,2013-05-07 00:54:47,2013-05-07T00:54:47Z,CREATED_BY_18153,NULL,250.0,NULL,NULL
Table contains the header information for all CPM projects.,BU50T1_PROJECTS,CREATED_BY,CreatedBy,Created by Userid,Created by Userid,VARCHAR2,2013-05-07 00:54:47,2013-05-07T00:54:47Z,CREATED_BY_18176,NULL,250.0,user,NULL
Contains the attachments data loaded a CPM project.,BU50T1_PROJECT_FILE,CREATED_BY,CreatedBy,Created by Userid,Created by Userid,VARCHAR2,2013-05-07 00:54:47,2013-05-07T00:54:47Z,CREATED_BY_18228,NULL,250.0,user,NULL
contains the current funding information for a project at the overall project level.,BU50T1_PROJECT_FUNDS,CREATED_BY,CreatedBy,Created by Userid,Created by Userid,VARCHAR2,2013-05-07 00:54:47,2013-05-07T00:54:47Z,CREATED_BY_18235,NULL,250.0,NULL,NULL
Contains all project fund changes.,BU50T1_PROJECT_FUND_JN,CREATED_BY,CreatedBy,Created by Userid,Created by Userid,VARCHAR2,2013-05-07 00:54:47,2013-05-07T00:54:47Z,CREATED_BY_18265,NULL,250.0,NULL,NULL
Stores the project major tasks.,BU50T1_PROJECT_MAJOR_TASKS,CREATED_BY,CreatedBy,Created by Userid,Created by Userid,VARCHAR2,2013-05-07 00:54:47,2013-05-07T00:54:47Z,CREATED_BY_18275,NULL,250.0,NULL,NULL
Stores attachments for the projects major task.,BU50T1_PROJECT_MAJOR_TASK_FILE,CREATED_BY,CreatedBy,Created by Userid,Created by Userid,VARCHAR2,2013-05-07 00:54:48,2013-05-07T00:54:48Z,CREATED_BY_18284,NULL,250.0,user,NULL
Stores the major task requisition.,BU50T1_PROJECT_MAJOR_TASK_REQ,CREATED_BY,CreatedBy,Created by Userid,Created by Userid,VARCHAR2,2013-05-07 00:54:48,2013-05-07T00:54:48Z,CREATED_BY_18294,NULL,250.0,NULL,NULL
Current overall notes for the CPM project.,BU50T1_PROJECT_NOTES,CREATED_BY,CreatedBy,Created by Userid,Created by Userid,VARCHAR2,2013-05-07 00:54:48,2013-05-07T00:54:48Z,CREATED_BY_18305,NULL,250.0,user,NULL
Contains all project notes contained in CPM,BU50T1_PROJECT_NOTE_JN,CREATED_BY,CreatedBy,Created by Userid,Created by Userid,VARCHAR2,2013-05-07 00:54:48,2013-05-07T00:54:48Z,CREATED_BY_18316,NULL,250.0,user,NULL
Table not used,BU50T1_PROJECT_NOTIFICATIONS,CREATED_BY,CreatedBy,Created by Userid,Created by Userid,VARCHAR2,2013-05-07 00:54:48,2013-05-07T00:54:48Z,CREATED_BY_18323,NULL,250.0,user,NULL
Contains the current CPM project phases for a CPM project.,BU50T1_PROJECT_PHASES,CREATED_BY,CreatedBy,Created by Userid,Created by Userid,VARCHAR2,2013-05-07 00:54:48,2013-05-07T00:54:48Z,CREATED_BY_18332,NULL,250.0,NULL,NULL
Contains all the CPM project phases for a CPM project.,BU50T1_PROJECT_PHASE_JN,CREATED_BY,CreatedBy,Created by Userid,Created by Userid,VARCHAR2,2013-05-07 00:54:48,2013-05-07T00:54:48Z,CREATED_BY_18369,NULL,250.0,NULL,NULL
Contains the project phases from the CIP system which was replaced by CPM.,BU50T1_PROJECT_PHASE_LEGACY,CREATED_BY,CreatedBy,Created by Userid,Created by Userid,VARCHAR2,2013-05-07 00:54:48,2013-05-07T00:54:48Z,CREATED_BY_18394,NULL,250.0,NULL,NULL
Table not used.,BU50T1_PROJECT_PHASE_NOTES,CREATED_BY,CreatedBy,Created by Userid,Created by Userid,VARCHAR2,2013-05-07 00:54:48,2013-05-07T00:54:48Z,CREATED_BY_18410,NULL,250.0,user,NULL
Table not used.,BU50T1_PROJECT_REQUISITIONS,CREATED_BY,CreatedBy,Created by Userid,Created by Userid,VARCHAR2,2013-05-07 00:54:48,2013-05-07T00:54:48Z,CREATED_BY_18435,NULL,250.0,NULL,NULL
Table not used.,BU50T1_PROJECT_REQ_NOTES,CREATED_BY,CreatedBy,Created by Userid,Created by Userid,VARCHAR2,2013-05-07 00:54:48,2013-05-07T00:54:48Z,CREATED_BY_18446,NULL,250.0,NULL,NULL
Contains the tasks assigned to a project address.,BU50T1_PROJECT_TASKS,CREATED_BY,CreatedBy,Created by Userid,Created by Userid,VARCHAR2,2013-05-07 00:54:48,2013-05-07T00:54:48Z,CREATED_BY_18460,NULL,250.0,NULL,NULL
Contains the current task notes for a CPM project.,BU50T1_PROJECT_TASK_NOTES,CREATED_BY,CreatedBy,Created by Userid,Created by Userid,VARCHAR2,2013-05-07 00:54:48,2013-05-07T00:54:48Z,CREATED_BY_18479,NULL,250.0,NULL,NULL
Contains all the task notes for a CPM project.,BU50T1_PROJECT_TASK_NOTE_JN,CREATED_BY,CreatedBy,Created by Userid,Created by Userid,VARCHAR2,2013-05-07 00:54:48,2013-05-07T00:54:48Z,CREATED_BY_18490,NULL,250.0,NULL,NULL
"Year a CPM project was published in the capital improvement program"" book.""",BU50T1_PROJECT_YEAR_PUBLISHED,CREATED_BY,CreatedBy,Created by Userid,Created by Userid,VARCHAR2,2013-05-07 00:54:48,2013-05-07T00:54:48Z,CREATED_BY_18496,NULL,250.0,user,NULL
Table not used.,BU50T1_PROJ_FUNDING_PROCESSES,CREATED_BY,CreatedBy,Created by Userid,Created by Userid,VARCHAR2,2013-05-07 00:54:48,2013-05-07T00:54:48Z,CREATED_BY_18503,NULL,250.0,NULL,NULL
Table not used.,BU50T1_PROJ_FUNDING_SOURCES,CREATED_BY,CreatedBy,Created by Userid,Created by Userid,VARCHAR2,2013-05-07 00:54:48,2013-05-07T00:54:48Z,CREATED_BY_18513,NULL,250.0,NULL,NULL
FMPS funding strips currently associated to a CPM project.,BU50T1_PROJ_FUNDING_STRIPS,CREATED_BY,CreatedBy,Created by Userid,Created by Userid,VARCHAR2,2013-05-07 00:54:48,2013-05-07T00:54:48Z,CREATED_BY_18534,NULL,250.0,NULL,NULL
All FMPS funding strips associated to a CPM project.,BU50T1_PROJ_FUNDING_STRIPS_JN,CREATED_BY,CreatedBy,Created by Userid,Created by Userid,VARCHAR2,2013-05-07 00:54:49,2013-05-07T00:54:49Z,CREATED_BY_18557,NULL,250.0,NULL,NULL
Stores the project major task work types.,BU50T1_PROJ_MAJ_TASK_WORK_TYPE,CREATED_BY,CreatedBy,Created by Userid,Created by Userid,VARCHAR2,2013-05-07 00:54:49,2013-05-07T00:54:49Z,CREATED_BY_18563,NULL,250.0,NULL,NULL
Used in the CIP system; not used on the CPM system.,BU50T1_PROJ_PHASE_CONTRACTORS,CREATED_BY,CreatedBy,Created by Userid,Created by Userid,VARCHAR2,2013-05-07 00:54:49,2013-05-07T00:54:49Z,CREATED_BY_18571,NULL,250.0,NULL,NULL
Contains all reports in the CPM system along with their user description.,BU50T1_REPORTS,CREATED_BY,CreatedBy,Created by Userid,Created by Userid,VARCHAR2,2013-05-07 00:54:49,2013-05-07T00:54:49Z,CREATED_BY_18592,NULL,250.0,user,NULL
Stores CPM report category groupings.,BU50T1_REPORT_GROUP_CATEGORIES,CREATED_BY,CreatedBy,Created by Userid,Created by Userid,VARCHAR2,2013-05-07 00:54:49,2013-05-07T00:54:49Z,CREATED_BY_18603,NULL,250.0,user,NULL
Controls which report categories a user is able to view.,BU50T1_REPORT_GROUP_CAT_DN,CREATED_BY,CreatedBy,Created by Userid,Created by Userid,VARCHAR2,2013-05-07 00:54:49,2013-05-07T00:54:49Z,CREATED_BY_18610,NULL,250.0,user,NULL
CPM report parameters,BU50T1_REPORT_PARMS,CREATED_BY,CreatedBy,Created by Userid,Created by Userid,VARCHAR2,2013-05-07 00:54:49,2013-05-07T00:54:49Z,CREATED_BY_18619,NULL,250.0,NULL,NULL
CPM report parameters linking the user label to the SQL cursor used.,BU50T1_REPORT_PARM_LOOKUP,CREATED_BY,CreatedBy,Created by Userid,Created by Userid,VARCHAR2,2013-05-07 00:54:49,2013-05-07T00:54:49Z,CREATED_BY_18633,NULL,250.0,NULL,NULL
CIP benchmark data; not used in CPM.,BU50T1_RESP_DN_BENCHMARKS,CREATED_BY,CreatedBy,Created by Userid,Created by Userid,VARCHAR2,2013-05-07 00:54:49,2013-05-07T00:54:49Z,CREATED_BY_18645,NULL,250.0,NULL,NULL
Responsible department for a facility.,BU50T1_RESP_DN_FACILITIES,CREATED_BY,CreatedBy,Created by Userid,Created by Userid,VARCHAR2,2013-05-07 00:54:49,2013-05-07T00:54:49Z,CREATED_BY_18655,NULL,250.0,NULL,NULL
Table not used.,BU50T1_RESP_DN_FUNDING_PROCESS,CREATED_BY,CreatedBy,Created by Userid,Created by Userid,VARCHAR2,2013-05-07 00:54:49,2013-05-07T00:54:49Z,CREATED_BY_18662,NULL,250.0,NULL,NULL
Controls which department can view/use a fund in CPM.,BU50T1_RESP_DN_FUNDS,CREATED_BY,CreatedBy,Created by Userid,Created by Userid,VARCHAR2,2013-05-07 00:54:49,2013-05-07T00:54:49Z,CREATED_BY_18669,NULL,250.0,NULL,NULL
Table not used.,BU50T1_RESP_DN_PROGRAMS,CREATED_BY,CreatedBy,Created by Userid,Created by Userid,VARCHAR2,2013-05-07 00:54:49,2013-05-07T00:54:49Z,CREATED_BY_18678,NULL,250.0,NULL,NULL
Controls which departments can view/use a sub-program.,BU50T1_RESP_DN_SUB_PROGRAMS,CREATED_BY,CreatedBy,Created by Userid,Created by Userid,VARCHAR2,2013-05-07 00:54:49,2013-05-07T00:54:49Z,CREATED_BY_18685,NULL,250.0,NULL,NULL
Controls which work types can be seen/used by a department.,BU50T1_RESP_DN_WORK_TYPES,CREATED_BY,CreatedBy,Created by Userid,Created by Userid,VARCHAR2,2013-05-07 00:54:49,2013-05-07T00:54:49Z,CREATED_BY_18694,NULL,250.0,NULL,NULL
Table contains no data.,BU50T1_ROLES,CREATED_BY,CreatedBy,Created by Userid,Created by Userid,VARCHAR2,2013-05-07 00:54:49,2013-05-07T00:54:49Z,CREATED_BY_18704,NULL,30.0,NULL,NULL
Contains a full list of all valid street available for geocoding purposes,BU50T1_STREETS,CREATED_BY,CreatedBy,Created by Userid,Created by Userid,VARCHAR2,2013-05-07 00:54:49,2013-05-07T00:54:49Z,CREATED_BY_18724,NULL,250.0,NULL,NULL
Contains all program/sub-program combinations.,BU50T1_SUB_PROGRAMS,CREATED_BY,CreatedBy,Created by Userid,Created by Userid,VARCHAR2,2013-05-07 00:54:49,2013-05-07T00:54:49Z,CREATED_BY_18734,NULL,250.0,NULL,NULL
Contains all CIP vendors.,BU50T1_VENDORS,CREATED_BY,CreatedBy,Created by Userid,Created by Userid,VARCHAR2,2013-05-07 00:54:49,2013-05-07T00:54:49Z,CREATED_BY_18750,NULL,250.0,NULL,NULL
Contains the CPM work categories.,BU50T1_WORK_CATEGORIES,CREATED_BY,CreatedBy,Created by Userid,Created by Userid,VARCHAR2,2013-05-07 00:54:49,2013-05-07T00:54:49Z,CREATED_BY_18757,NULL,250.0,NULL,NULL
Contains all the work types listed in CPM.,BU50T1_WORK_TYPES,CREATED_BY,CreatedBy,Created by Userid,Created by Userid,VARCHAR2,2013-05-07 00:54:49,2013-05-07T00:54:49Z,CREATED_BY_18768,NULL,250.0,NULL,NULL
data used for creating pay schedule for aldermanic staff published in the Budget Book,BOOK_ALDERMANIC_PAYRATE,CREATION_DATE,CreationDate,NULL,NULL,DATE,2013-05-07 00:53:46,2013-05-07T00:53:46Z,CREATION_DATE_15060,NULL,7.0,NULL,NULL
Level for organizational budgeting by dept number,BU25T1_APPR,CREATION_DATE,CreationDate,NULL,NULL,DATE,2013-05-07 00:53:47,2013-05-07T00:53:47Z,CREATION_DATE_15326,NULL,7.0,sysdate,NULL
Appropriation amounts at the account level during the budget budget process. Child of bu25t1_appr table.,BU25T1_APPR_AMTS,CREATION_DATE,CreationDate,NULL,NULL,DATE,2013-05-07 00:53:47,2013-05-07T00:53:47Z,CREATION_DATE_15359,NULL,7.0,sysdate,NULL
A library listing City department,BU25T1_CODE_OBJECTS,CREATION_DATE,CreationDate,NULL,NULL,DATE,2013-05-07 00:53:48,2013-05-07T00:53:48Z,CREATION_DATE_15491,NULL,7.0,sysdate,NULL
Lists the categories of codes available on bu25t1_code_objects. Key is ref code,BU25T1_CODE_TYPES,CREATION_DATE,CreationDate,NULL,NULL,DATE,2013-05-07 00:53:48,2013-05-07T00:53:48Z,CREATION_DATE_15514,NULL,7.0,sysdate,NULL
programs for equipment note,BU25T1_EPROGRAMS,CREATION_DATE,CreationDate,NULL,NULL,DATE,2013-05-07 00:53:49,2013-05-07T00:53:49Z,CREATION_DATE_15761,NULL,7.0,sysdate,NULL
program items for equipment note requests,BU25T1_EPROGRAM_ITEMS,CREATION_DATE,CreationDate,NULL,NULL,DATE,2013-05-07 00:53:49,2013-05-07T00:53:49Z,CREATION_DATE_15778,NULL,7.0,sysdate,NULL
Equipment note subsystem account data with history. Child table of bu25t1_appr.,BU25T1_EQUIP_AMTS,CREATION_DATE,CreationDate,NULL,NULL,DATE,2013-05-07 00:53:49,2013-05-07T00:53:49Z,CREATION_DATE_15804,NULL,7.0,sysdate,NULL
Expenditure data from City Comptrollers FMPS system,BU25T1_FMPS_IMPORT,CREATION_DATE,CreationDate,NULL,NULL,DATE,2013-05-07 00:53:49,2013-05-07T00:53:49Z,CREATION_DATE_15936,NULL,7.0,sysdate,NULL
Expenditure raw data from City Comptrollers FMPS system,BU25T1_FMPS_IMPORT_DETAIL,CREATION_DATE,CreationDate,NULL,NULL,DATE,2013-05-07 00:53:49,2013-05-07T00:53:49Z,CREATION_DATE_15948,NULL,7.0,sysdate,NULL
Historical data for dept/fund/org/account appropriations since 1989,BU25T1_HISTORY_ACCTS,CREATION_DATE,CreationDate,NULL,NULL,DATE,2013-05-07 00:53:50,2013-05-07T00:53:50Z,CREATION_DATE_15960,NULL,7.0,NULL,NULL
Historical position counts for each dept/fund/org since 1989,BU25T1_HISTORY_TOTALS,CREATION_DATE,CreationDate,NULL,NULL,DATE,2013-05-07 00:53:50,2013-05-07T00:53:50Z,CREATION_DATE_16001,NULL,7.0,NULL,NULL
Historical list of every dept/fund/org going back to 1989,BU25T1_HISTORY_XORGS,CREATION_DATE,CreationDate,NULL,NULL,DATE,2013-05-07 00:53:50,2013-05-07T00:53:50Z,CREATION_DATE_16041,NULL,7.0,NULL,NULL
A dictionary of all reports in CBS,BU25T1_MODULES,CREATION_DATE,CreationDate,NULL,NULL,DATE,2013-05-07 00:53:50,2013-05-07T00:53:50Z,CREATION_DATE_16160,NULL,7.0,sysdate,NULL
Department organizations from 1000 to 4000 level and the organization they report to. Self referential.,BU25T1_ORGS,CREATION_DATE,CreationDate,NULL,NULL,DATE,2013-05-07 00:53:50,2013-05-07T00:53:50Z,CREATION_DATE_16185,NULL,7.0,sysdate,NULL
Dept programs,BU25T1_PROGRAMS,CREATION_DATE,CreationDate,NULL,NULL,DATE,2013-05-07 00:53:50,2013-05-07T00:53:50Z,CREATION_DATE_16209,NULL,7.0,sysdate,NULL
List of all department program descriptions,BU25T1_PROGRAM_DESC,CREATION_DATE,CreationDate,NULL,NULL,DATE,2013-05-07 00:53:50,2013-05-07T00:53:50Z,CREATION_DATE_16226,NULL,7.0,sysdate,NULL
Lowest level for budget accounts. Itemizing what is in nonpersonnel accounts,BU25T1_PROGRAM_ITEMS,CREATION_DATE,CreationDate,NULL,NULL,DATE,2013-05-07 00:53:51,2013-05-07T00:53:51Z,CREATION_DATE_16243,NULL,7.0,sysdate,NULL
Was used to for displaying performance measures in the Program Book. Currently not used.,BU25T1_PROGRAM_PM_IND,CREATION_DATE,CreationDate,NULL,NULL,DATE,2013-05-07 00:53:51,2013-05-07T00:53:51Z,CREATION_DATE_16270,NULL,7.0,sysdate,NULL
revenue collections provided by Dept of Finance revenue collections. Child table of bu25t1_revenue_appr,BU25T1_REVENUE_AMTS,CREATION_DATE,CreationDate,NULL,NULL,DATE,2013-05-07 00:53:51,2013-05-07T00:53:51Z,CREATION_DATE_16287,NULL,7.0,sysdate,NULL
Revenue collections root table by dept,BU25T1_REVENUE_APPR,CREATION_DATE,CreationDate,NULL,NULL,DATE,2013-05-07 00:53:51,2013-05-07T00:53:51Z,CREATION_DATE_16301,NULL,7.0,sysdate,NULL
List of general revenue categories and groupings,BU25T1_REV_ORGS,CREATION_DATE,CreationDate,NULL,NULL,DATE,2013-05-07 00:53:51,2013-05-07T00:53:51Z,CREATION_DATE_16334,NULL,7.0,sysdate,NULL
specific revenue sources that have been collected by Dept of Finance - revenue section,BU25T1_RPROGRAMS,CREATION_DATE,CreationDate,NULL,NULL,DATE,2013-05-07 00:53:51,2013-05-07T00:53:51Z,CREATION_DATE_16341,NULL,7.0,sysdate,NULL
List of more specific revenue source codes and descriptions,BU25T1_RPROGRAM_DESC,CREATION_DATE,CreationDate,NULL,NULL,DATE,2013-05-07 00:53:51,2013-05-07T00:53:51Z,CREATION_DATE_16352,NULL,7.0,sysdate,NULL
Revenue collection from Dept of Finance - Revenue section. Itemized data.,BU25T1_RPROGRAM_ITEMS,CREATION_DATE,CreationDate,NULL,NULL,DATE,2013-05-07 00:53:51,2013-05-07T00:53:51Z,CREATION_DATE_16360,NULL,7.0,sysdate,NULL
Pay schedules and grades.,BU25T1_SCHEDULES,CREATION_DATE,CreationDate,NULL,NULL,DATE,2013-05-07 00:53:51,2013-05-07T00:53:51Z,CREATION_DATE_16378,NULL,7.0,NULL,NULL
Child of bu25t1_schedules. Pay rates by chedule,BU25T1_STEPS,CREATION_DATE,CreationDate,NULL,NULL,DATE,2013-05-07 00:53:51,2013-05-07T00:53:51Z,CREATION_DATE_16413,NULL,7.0,NULL,NULL
Used for applying new step increases in effect for next budget year,BU25T1_STEPS_NEW,CREATION_DATE,CreationDate,NULL,NULL,DATE,2013-05-07 00:53:51,2013-05-07T00:53:51Z,CREATION_DATE_16428,NULL,7.0,NULL,NULL
List of CBS users,BU25T1_USER_ACCESS,CREATION_DATE,CreationDate,NULL,NULL,DATE,2013-05-07 00:53:51,2013-05-07T00:53:51Z,CREATION_DATE_16485,NULL,7.0,sysdate,NULL
List of depts or dept/bureaus that CBS users are restricted to,BU25T1_USER_DEPT_ACCESS,CREATION_DATE,CreationDate,NULL,NULL,DATE,2013-05-07 00:53:51,2013-05-07T00:53:51Z,CREATION_DATE_16505,NULL,7.0,sysdate,NULL
Contains the prior years appropriation.,BU26T1_APPR,CREATION_DATE,CreationDate,date created,date created,DATE,2013-05-07 00:53:52,2013-05-07T00:53:52Z,CREATION_DATE_16516,NULL,7.0,sysdate,NULL
Contains references that are used by the budget system (CBS) for processing and application use.,BU26T1_CODE_OBJECTS,CREATION_DATE,CreationDate,date created,date created,DATE,2013-05-07 00:53:52,2013-05-07T00:53:52Z,CREATION_DATE_16549,NULL,7.0,sysdate,NULL
Stores the organizations used by the budget system (CBS); a parent table that contains all the organizations.,BU26T1_ORGS,CREATION_DATE,CreationDate,date created,date created,DATE,2013-05-07 00:53:52,2013-05-07T00:53:52Z,CREATION_DATE_16577,NULL,7.0,sysdate,NULL
Stores the payroll information used for chicago budget system (CBS) reporting purposes.,BU26T1_PAYROLL,CREATION_DATE,CreationDate,date created,date created,DATE,2013-05-07 00:53:52,2013-05-07T00:53:52Z,CREATION_DATE_16590,NULL,7.0,sysdate,NULL
Stores the payrolls that have already been processed for the current year.,BU26T1_PAYROLLS_PROCESSED,CREATION_DATE,CreationDate,date created,date created,DATE,2013-05-07 00:53:52,2013-05-07T00:53:52Z,CREATION_DATE_16595,NULL,7.0,NULL,NULL
Stores the most recent payroll.,BU26T1_PAYROLL_DETAIL,CREATION_DATE,CreationDate,date created,date created,DATE,2013-05-07 00:53:52,2013-05-07T00:53:52Z,CREATION_DATE_16613,NULL,7.0,sysdate,NULL
Stores previous payrolls copied from the BU26T1_PAYROLL_DETAIL table.,BU26T1_PAYROLL_HISTORY,CREATION_DATE,CreationDate,date created,date created,DATE,2013-05-07 00:53:52,2013-05-07T00:53:52Z,CREATION_DATE_16631,NULL,7.0,sysdate,NULL
stores contract information entered by the procurement department.,BU50T1_DT_CONTRACTS,CREATION_DATE,CreationDate,Date created,Date created,DATE,2013-05-07 00:54:46,2013-05-07T00:54:46Z,CREATION_DATE_17791,NULL,7.0,NULL,NULL
stores contract cycle information.,BU50T1_DT_CONTRACT_CYCLES,CREATION_DATE,CreationDate,Date created,Date created,DATE,2013-05-07 00:54:46,2013-05-07T00:54:46Z,CREATION_DATE_17837,NULL,7.0,NULL,NULL
stores information regarding the contract cycle steps.,BU50T1_DT_CYCLE_SETUPS,CREATION_DATE,CreationDate,Date created,Date created,DATE,2013-05-07 00:54:46,2013-05-07T00:54:46Z,CREATION_DATE_17851,NULL,7.0,NULL,NULL
"contains lookup values that are used by the other BU50T1_DT"" tables.""",BU50T1_DT_LOOKUPS,CREATION_DATE,CreationDate,Date created,Date created,DATE,2013-05-07 00:54:46,2013-05-07T00:54:46Z,CREATION_DATE_17864,NULL,7.0,NULL,NULL
Contains identification card information,EPI_CARD.DBA,Creation_Date,CreationDate,Creation date,Creation date,Date/Time,2013-05-07 01:04:49,2013-05-07T01:04:49Z,Creation_Date_20316,NULL,'NULL',NULL,6/22/2011 20:09
Contains demographic information of registered clients,EPI_PERSON.DBA,Creation_Date,CreationDate,Date of client information created,Date of client information created,Date/Time,2013-05-07 01:04:49,2013-05-07T01:04:49Z,Creation_Date_20329,NULL,'NULL',NULL,6/22/2011 20:09
Stores payroll information containing what FMPS has paid out.,BU26T1_PAYROLL_FMPS_DETAIL,CREDIT,CREDIT,credited to the fund from the department.,credited to the fund from the department.,NUMBER,2013-05-07 00:53:52,2013-05-07T00:53:52Z,CREDIT_16623,NULL,22.0,NULL,NULL
stores contract information entered by the procurement department.,BU50T1_DT_CONTRACTS,CRITICAL,CRITICAL,NULL,NULL,VARCHAR2,2013-05-07 00:54:46,2013-05-07T00:54:46Z,CRITICAL_17809,NULL,5.0,NULL,NULL
Contains all reports in the CPM system along with their user description.,BU50T1_REPORTS,CSV,CSV,Y - exportable in comma separated format,Y - exportable in comma separated format,VARCHAR2,2013-05-07 00:54:49,2013-05-07T00:54:49Z,CSV_18596,NULL,1.0,N,NULL
Homelessness program. If applicant leases their facility,DHS_LEASE_INFORMATION,CURRENTLY_LEASING,CURRENTLY_LEASING,1 - yes,1 - yes,NUMBER,2013-05-07 00:54:17,2013-05-07T00:54:17Z,CURRENTLY_LEASING_16941,NULL,22.0,1=Yes,NULL
General list of reference codes group by rv_domain,BU50T1_REF_CODES,CURRENT_VALUE,CURRENT_VALUE,NULL,NULL,VARCHAR2,2013-05-07 00:54:49,2013-05-07T00:54:49Z,CURRENT_VALUE_18583,NULL,1.0,NULL,NULL
Used for applying new rates in effect for next budget year,BU25T1_ORNR,CURR_RATE,CURR_RATE,current BPR,current BPR,NUMBER,2013-05-07 00:53:50,2013-05-07T00:53:50Z,CURR_RATE_16199,NULL,22.0,NULL,NULL
special payrates for specific titles,BU25T1_SPECIAL_RATES,CURR_RATE,CURR_RATE,current payrate,current payrate,NUMBER,2013-05-07 00:53:51,2013-05-07T00:53:51Z,CURR_RATE_16392,NULL,22.0,NULL,NULL
Was used to for displaying performance measures in the Program Book. Currently not used.,BU25T1_PROGRAM_PM_IND,CURR_YE,CURR_YE,current year end targets,current year end targets,VARCHAR2,2013-05-07 00:53:51,2013-05-07T00:53:51Z,CURR_YE_16280,NULL,240.0,NULL,NULL
revenue collections provided by Dept of Finance revenue collections. Child table of bu25t1_revenue_appr,BU25T1_REVENUE_AMTS,CURR_YEAR_MONTH_TOTAL,CURR_YEAR_MONTH_TOTAL,current year month totals,current year month totals,NUMBER,2013-05-07 00:53:51,2013-05-07T00:53:51Z,CURR_YEAR_MONTH_TOTAL_16296,NULL,22.0,NULL,NULL
Monthly revenue collection data provided to OBM from Dept of Finance Revenue Section,BU25T1_REVENUE_HOLD,CURR_YEAR_MONTH_TOTAL,CURR_YEAR_MONTH_TOTAL,amounts for this year and month,amounts for this year and month,VARCHAR2,2013-05-07 00:53:51,2013-05-07T00:53:51Z,CURR_YEAR_MONTH_TOTAL_16321,NULL,100.0,NULL,NULL
