Table Description,Table Name,Name,Name clean,Description,Description clean,'Type / Format',Last Updated,Last Updated date,File Name,Comments,Length,Values,Example
Contains basic audit  information,Audits,PO#,PO,Puchase number,Puchase number,Text,2013-05-07 01:04:34,2013-05-07T01:04:34Z,PO#_20299,NULL,50.0,NOT NULL,23456
Delegate addresses,ADDRESS,POLICE_DISTRICT,POLICE_DISTRICT,located in police district,located in police district,VARCHAR2,2013-05-07 00:54:16,2013-05-07T00:54:16Z,POLICE_DISTRICT_16685,NULL,15.0,NULL,NULL
The details within a Budget Book/Grant Book BOOK_SECTION,BOOK_PAGE_ELEMENT,POSITION,POSITION,order that element appears in a book section,order that element appears in a book section,NUMBER,2013-05-07 00:53:46,2013-05-07T00:53:46Z,POSITION_15103,NULL,22.0,NULL,NULL
Snapshot of current employee information from CHIPPS system (HR) for creating employee and positions at budget startup.,BU25T1_CHIPPS_STARTUP_EMP,POSITION_START,POSITION_START,Start date for this title,Start date for this title,DATE,2013-05-07 00:53:48,2013-05-07T00:53:48Z,POSITION_START_15440,NULL,7.0,NULL,NULL
A daily list of all personnel changes from CHIPPS (HR) during the budget process. ie resignations,BU25T1_EMP_HOLD_TEMP,POSITION_START_DATE,POSITION_START_DATE,position start date,position start date,DATE,2013-05-07 00:53:49,2013-05-07T00:53:49Z,POSITION_START_DATE_15747,NULL,7.0,NULL,NULL
Contains demographic information of registered clients,EPI_PERSON.DBA,Postal_Code,Postal_Code,Not used,Not used,TEXT,2013-05-07 01:04:49,2013-05-07T01:04:49Z,Postal_Code_20351,NULL,20.0,NULL,NULL
Position data to be loaded into CHIPPS database on Jan. 1,BU25T1_CHIPPS_EXTRACT_POS,POS_TYPE,POS_TYPE,relevant to CHIPPS system,relevant to CHIPPS system,VARCHAR2,2013-05-07 00:53:48,2013-05-07T00:53:48Z,POS_TYPE_15413,NULL,6.0,NULL,NULL
stores contract information entered by the procurement department.,BU50T1_DT_CONTRACTS,PO_END_DATE,PO_END_DATE,NULL,NULL,DATE,2013-05-07 00:54:46,2013-05-07T00:54:46Z,PO_END_DATE_17799,NULL,7.0,NULL,NULL
stores contract information entered by the procurement department.,BU50T1_DT_CONTRACTS,PO_HEADER_ID,PO_HEADER_ID,NULL,NULL,NUMBER,2013-05-07 00:54:46,2013-05-07T00:54:46Z,PO_HEADER_ID_17777,NULL,22.0,NULL,NULL
stores contract information entered by the procurement department.,BU50T1_DT_CONTRACTS,PO_START_DATE,PO_START_DATE,NULL,NULL,DATE,2013-05-07 00:54:46,2013-05-07T00:54:46Z,PO_START_DATE_17798,NULL,7.0,NULL,NULL
List of bargaining units for City of Chicago employees,BU25T1_BARG_UNIT,PRELIM_0005_PCT,PRELIM_0005_PCT,Percentage of amount to use as preliminary budget base,Percentage of amount to use as preliminary budget base,NUMBER,2013-05-07 00:53:47,2013-05-07T00:53:47Z,PRELIM_0005_PCT_15392,NULL,22.0,0,NULL
Stores the preliminary yearly budget at the start of the budget cycle.,BU26T1_PRELIM,PRELIM_SEQ,PRELIM_SEQ,Primary key,Primary key,NUMBER,2013-05-07 00:53:52,2013-05-07T00:53:52Z,PRELIM_SEQ_16637,NULL,22.0,NULL,NULL
Stores the preliminary yearly budget at the start of the budget cycle.,BU26T1_PRELIM,PRELIM_START_UP,PRELIM_START_UP,Preliminary startup estimate,Preliminary startup estimate,NUMBER,2013-05-07 00:53:52,2013-05-07T00:53:52Z,PRELIM_START_UP_16645,NULL,22.0,NULL,NULL
contains information about upcoming and past programs,Adult Services Programs,Press reservations,Press reservations,Press reservations,Press reservations,text box,2013-09-26 14:44:41,2013-09-26T14:44:41Z,Press reservations_20439,NULL,'NULL',NULL,journalist from Sun Times
List of previous funding applicant has received for the program they are applying for,PREVIOUS_FUNDING,PREVIOUS_FUNDING_AMOUNT,PREVIOUS_FUNDING_AMOUNT,previous funding amount provided by the funding source,previous funding amount provided by the funding source,NUMBER,2013-05-07 00:54:18,2013-05-07T00:54:18Z,PREVIOUS_FUNDING_AMOUNT_17266,NULL,22.0,NULL,NULL
List of previous funding applicant has received for the program they are applying for,PREVIOUS_FUNDING,PREVIOUS_FUNDING_DEPT,PREVIOUS_FUNDING_DEPT,Foreign key to DEPARTMENT.ID,Foreign key to DEPARTMENT.ID,NUMBER,2013-05-07 00:54:18,2013-05-07T00:54:18Z,PREVIOUS_FUNDING_DEPT_17265,NULL,22.0,NULL,NULL
revenue collections provided by Dept of Finance revenue collections. Child table of bu25t1_revenue_appr,BU25T1_REVENUE_AMTS,PREV_YEAR_MONTH_TOTAL,PREV_YEAR_MONTH_TOTAL,previous year same month totals - for comparison,previous year same month totals - for comparison,NUMBER,2013-05-07 00:53:51,2013-05-07T00:53:51Z,PREV_YEAR_MONTH_TOTAL_16297,NULL,22.0,NULL,NULL
Monthly revenue collection data provided to OBM from Dept of Finance Revenue Section,BU25T1_REVENUE_HOLD,PREV_YEAR_MONTH_TOTAL,PREV_YEAR_MONTH_TOTAL,amounts for previous year and month,amounts for previous year and month,VARCHAR2,2013-05-07 00:53:51,2013-05-07T00:53:51Z,PREV_YEAR_MONTH_TOTAL_16323,NULL,100.0,NULL,NULL
Revenue collection from Dept of Finance - Revenue section. Itemized data.,BU25T1_RPROGRAM_ITEMS,PREV_YEAR_MONTH_TOTAL,PREV_YEAR_MONTH_TOTAL,previous year same month totals - for comparison,previous year same month totals - for comparison,NUMBER,2013-05-07 00:53:51,2013-05-07T00:53:51Z,PREV_YEAR_MONTH_TOTAL_16369,NULL,22.0,NULL,NULL
Contains basic meal type information,Meals,Price,Price,Price of meal,Price of meal,Text,2013-05-07 01:03:02,2013-05-07T01:03:02Z,Price_20176,NULL,50.0,NOT NULL,3.5
Equipment note subsystem account data with history. Child table of bu25t1_appr.,BU25T1_EQUIP_AMTS,PRINT,PRINT,indicator to print in Budget Book or not. Not relevant for ENote,indicator to print in Budget Book or not. Not relevant for ENote,VARCHAR2,2013-05-07 00:53:49,2013-05-07T00:53:49Z,PRINT_15812,NULL,1.0,Y,NULL
Contains identification card information,EPI_CARD.DBA,Print_Date,Print_Date,Date ID card printed,Date ID card printed,Date/Time,2013-05-07 01:04:49,2013-05-07T01:04:49Z,Print_Date_20325,NULL,'NULL',NULL,6/22/2011 20:09
Lowest level for budget accounts. Itemizing what is in nonpersonnel accounts,BU25T1_PROGRAM_ITEMS,PRINT_SEQ,PRINT_SEQ,Dept Owned,Dept Owned,NUMBER,2013-05-07 00:53:51,2013-05-07T00:53:51Z,PRINT_SEQ_16252,NULL,22.0,NULL,NULL
List of all department program descriptions,BU25T1_PROGRAM_DESC,PRIORITY,PRIORITY,Priority of Program,Priority of Program,NUMBER,2013-05-07 00:53:51,2013-05-07T00:53:51Z,PRIORITY_16239,NULL,22.0,NULL,NULL
Lowest level for budget accounts. Itemizing what is in nonpersonnel accounts,BU25T1_PROGRAM_ITEMS,PRIORITY,PRIORITY,Rank the items in terms of importance.,Rank the items in terms of importance.,NUMBER,2013-05-07 00:53:51,2013-05-07T00:53:51Z,PRIORITY_16253,NULL,22.0,NULL,NULL
Numeric range from 0 to 999 used for indicating how crucial a vacancy is,BU25T1_VAC_PRIORITIES,PRIORITY_NUMBER,PRIORITY_NUMBER,a unique number 0 to 999,a unique number 0 to 999,NUMBER,2013-05-07 00:53:52,2013-05-07T00:53:52Z,PRIORITY_NUMBER_16514,NULL,22.0,NULL,NULL
CDGA applications,APPLICATION,PRIOR_ACCOMPLISHMENTS,PRIOR_ACCOMPLISHMENTS,Describe projects prior accomplishments,Describe projects prior accomplishments,CLOB,2013-05-07 00:54:16,2013-05-07T00:54:16Z,PRIOR_ACCOMPLISHMENTS_16705,NULL,4000.0,NULL,NULL
Appropriation amounts at the account level during the budget budget process. Child of bu25t1_appr table.,BU25T1_APPR_AMTS,PRIOR_YR_EXP,PRIOR_YR_EXP,Prior Years Expenditures,Prior Years Expenditures,NUMBER,2013-05-07 00:53:47,2013-05-07T00:53:47Z,PRIOR_YR_EXP_15370,NULL,22.0,NULL,NULL
Expenditure data from City Comptrollers FMPS system,BU25T1_FMPS_IMPORT,PRIOR_YR_EXP,PRIOR_YR_EXP,prior year expenditure amount,prior year expenditure amount,NUMBER,2013-05-07 00:53:49,2013-05-07T00:53:49Z,PRIOR_YR_EXP_15944,NULL,22.0,NULL,NULL
Expenditure raw data from City Comptrollers FMPS system,BU25T1_FMPS_IMPORT_DETAIL,PRIOR_YR_EXP,PRIOR_YR_EXP,prior year expenditure amount,prior year expenditure amount,NUMBER,2013-05-07 00:53:50,2013-05-07T00:53:50Z,PRIOR_YR_EXP_15956,NULL,22.0,NULL,NULL
Stores the preliminary yearly budget at the start of the budget cycle.,BU26T1_PRELIM,PRIOR_YR_EXP,PRIOR_YR_EXP,prior year expenditures,prior year expenditures,NUMBER,2013-05-07 00:53:52,2013-05-07T00:53:52Z,PRIOR_YR_EXP_16640,NULL,22.0,NULL,NULL
Contains the prior years appropriation.,BU26T1_APPR,PRJ_YE_PAYROLL,PRJ_YE_PAYROLL,Project yearend payroll,Project yearend payroll,NUMBER,2013-05-07 00:53:52,2013-05-07T00:53:52Z,PRJ_YE_PAYROLL_16531,NULL,22.0,NULL,NULL
Stores the preliminary yearly budget at the start of the budget cycle.,BU26T1_PRELIM,PRJ_YR_END,PRJ_YR_END,projected year end,projected year end,NUMBER,2013-05-07 00:53:52,2013-05-07T00:53:52Z,PRJ_YR_END_16642,NULL,22.0,NULL,NULL
PIAD stands for Problem,PIAD,PROBLEM,PROBLEM,Narrative of problem that application will address,Narrative of problem that application will address,CLOB,2013-05-07 00:54:18,2013-05-07T00:54:18Z,PROBLEM_17252,NULL,4000.0,NULL,NULL
Deposit information,Deposit,ProcessDate,ProcessDate,Processed Date,Processed Date,Date,2013-09-27 13:24:47,2013-09-27T13:24:47Z,ProcessDate_20667,NULL,255.0,NOT NULL,4/1/2013
A list of all personnel changes from CHIPPS (HR) during the budget process. ie resignations,BU25T1_EMP_HOLD,PROCESSED,PROCESSED,was employee processed in CBS?,was employee processed in CBS?,VARCHAR2,2013-05-07 00:53:49,2013-05-07T00:53:49Z,PROCESSED_15728,NULL,1.0,NULL,NULL
Monthly revenue collection data provided to OBM from Dept of Finance Revenue Section,BU25T1_REVENUE_HOLD,PROGRAM,PROGRAM,specific revenue source code,specific revenue source code,VARCHAR2,2013-05-07 00:53:51,2013-05-07T00:53:51Z,PROGRAM_16314,NULL,100.0,NULL,NULL
CDGA applications,APPLICATION,PROGRAM,PROGRAM,Foreign key to PROGRAM evaluation,Foreign key to PROGRAM evaluation,NUMBER,2013-05-07 00:54:16,2013-05-07T00:54:16Z,PROGRAM_16734,NULL,22.0,NULL,NULL
contains information about upcoming and past programs,Adult Services Programs,Program description,Program description,Program description,Program description,text box,2013-09-26 14:44:41,2013-09-26T14:44:41Z,Program description_20417,this will be used on the events calendar,'NULL',NULL,Thomas Dyja joins us to discuss his new book titled The Third Coast: When Chicago Built the American Dream. Though today it can seem as if all American culture comes out of New York and Los Angeles
contains information about upcoming and past programs,Adult Services Programs,program participants,program participants,program participants,program participants,text box,2013-09-26 14:44:41,2013-09-26T14:44:41Z,program participants_20424,NULL,'NULL',NULL,?Thomas Dyja will appear alone.
contains information about upcoming and past programs,Adult Services Programs,program status,program status,program status,program status,drop-down menu,2013-09-26 14:44:42,2013-09-26T14:44:42Z,program status_20467,NULL,'NULL',NULL,complete
Contains basic agency  information,Agencies,ProgramName,ProgramName,Name of program,Name of program,Text,2013-05-07 01:04:34,2013-05-07T01:04:34Z,ProgramName_20292,NULL,50.0,NOT NULL,Youth
Contains basic agency  information,Agencies,ProgramType,ProgramType,Proram type,Proram type,Text,2013-05-07 01:04:34,2013-05-07T01:04:34Z,ProgramType_20293,NULL,50.0,NOT NULL,Homeless
List of CDGA programs,PROGRAM,PROGRAM_DESCRIPTION,PROGRAM_DESCRIPTION,Description of the program,Description of the program,CLOB,2013-05-07 00:54:18,2013-05-07T00:54:18Z,PROGRAM_DESCRIPTION_17283,NULL,4000.0,NULL,NULL
Applications for Homelessness programs managed by HUD,DHS_APPLICATION,PROGRAM_INFORMATION,PROGRAM_INFORMATION,Foreign key to DHS_PROGRAM_INFORMATION table,Foreign key to DHS_PROGRAM_INFORMATION table,NUMBER,2013-05-07 00:54:17,2013-05-07T00:54:17Z,PROGRAM_INFORMATION_16855,NULL,22.0,NULL,NULL
Homelessness program applicants program details,DHS_PROGRAM_INFORMATION,PROGRAM_MODEL,PROGRAM_MODEL,Homeless program model description,Homeless program model description,VARCHAR2,2013-05-07 00:54:17,2013-05-07T00:54:17Z,PROGRAM_MODEL_17010,NULL,50.0,NULL,NULL
Homelessness program. If applicant owns their facility,DHS_OWNERSHIP_INFORMATION,PROGRAM_MORTGAGE_PAYMENT,PROGRAM_MORTGAGE_PAYMENT,Amount of mortgage that program is responsible for.,Amount of mortgage that program is responsible for.,NUMBER,2013-05-07 00:54:17,2013-05-07T00:54:17Z,PROGRAM_MORTGAGE_PAYMENT_16998,NULL,22.0,NULL,NULL
List of CDGA programs,PROGRAM,PROGRAM_NAME,ProgramName,Name of the program,Name of the program,VARCHAR2,2013-05-07 00:54:18,2013-05-07T00:54:18Z,PROGRAM_NAME_17282,NULL,250.0,NULL,NULL
Applicants personnel budget for program they are applying for,PERSONNEL_BUDGET,PROGRAM_SHARE,PROGRAM_SHARE,Amount program is providing to the personnel budget,Amount program is providing to the personnel budget,NUMBER,2013-05-07 00:54:18,2013-05-07T00:54:18Z,PROGRAM_SHARE_17249,NULL,22.0,NULL,NULL
For applicants that provide congregate apartments.,DHS_CONGREGATE_HOUSING,PROGRAM_SQFT,PROGRAM_SQFT,square footage devoted to this program,square footage devoted to this program,NUMBER,2013-05-07 00:54:17,2013-05-07T00:54:17Z,PROGRAM_SQFT_16892,NULL,22.0,NULL,NULL
For applicants that applying for a non-residential program or social service program,DHS_SOCIAL_SERVICES,PROGRAM_SQFT,PROGRAM_SQFT,Square footage devoted to program,Square footage devoted to program,NUMBER,2013-05-07 00:54:18,2013-05-07T00:54:18Z,PROGRAM_SQFT_17096,NULL,22.0,NULL,NULL
stores contract information entered by the procurement department.,BU50T1_DT_CONTRACTS,PROGRAM_TYPE,ProgramType,NULL,NULL,VARCHAR2,2013-05-07 00:54:46,2013-05-07T00:54:46Z,PROGRAM_TYPE_17807,NULL,100.0,NULL,NULL
CDGA applications,APPLICATION,PROGRESS,PROGRESS,Narrative of progress,Narrative of progress,CLOB,2013-05-07 00:54:16,2013-05-07T00:54:16Z,PROGRESS_16708,NULL,4000.0,NULL,NULL
Homelessness program applicants information about their facilities,DHS_FACILITY,PROJECT_BASED_APTS,PROJECT_BASED_APTS,foreign key to DHS_PROJECT_BASED_APTS table,foreign key to DHS_PROJECT_BASED_APTS table,NUMBER,2013-05-07 00:54:17,2013-05-07T00:54:17Z,PROJECT_BASED_APTS_16911,NULL,22.0,NULL,NULL
Table contains the header information for all CPM projects.,BU50T1_PROJECTS,PROJECT_DESC,PROJECT_DESC,larger field for more info on a project,larger field for more info on a project,VARCHAR2,2013-05-07 00:54:47,2013-05-07T00:54:47Z,PROJECT_DESC_18160,NULL,240.0,NULL,NULL
CDGA applications,APPLICATION,PROJECT_DESCRIPTION,PROJECT_DESCRIPTION,Narrative about the project,Narrative about the project,CLOB,2013-05-07 00:54:16,2013-05-07T00:54:16Z,PROJECT_DESCRIPTION_16701,NULL,4000.0,NULL,NULL
CDGA applications,APPLICATION,PROJECT_NAME,PROJECT_NAME,Name of the application,Name of the application,VARCHAR2,2013-05-07 00:54:16,2013-05-07T00:54:16Z,PROJECT_NAME_16700,NULL,100.0,NULL,NULL
stores contract information entered by the procurement department.,BU50T1_DT_CONTRACTS,PROJECT_NAME,PROJECT_NAME,NULL,NULL,VARCHAR2,2013-05-07 00:54:46,2013-05-07T00:54:46Z,PROJECT_NAME_17780,NULL,450.0,NULL,NULL
CDGA applications,APPLICATION,PROJECT_NARRATIVE,PROJECT_NARRATIVE,Long description about application,Long description about application,CLOB,2013-05-07 00:54:16,2013-05-07T00:54:16Z,PROJECT_NARRATIVE_16703,NULL,4000.0,NULL,NULL
CDGA applications,APPLICATION,PROJECT_START_YEAR,PROJECT_START_YEAR,NOT USED,NOT USED,NUMBER,2013-05-07 00:54:16,2013-05-07T00:54:16Z,PROJECT_START_YEAR_16704,NULL,22.0,NULL,NULL
mapping of the CIP status to CPM status. no longer used since CIP has been retired.,BU50T1_CPM_STATUS_MAPPING,PROJECT_STATUS,PROJECT_STATUS,Compound primary key along with CIP_STATUS,Compound primary key along with CIP_STATUS,VARCHAR2,2013-05-07 00:54:45,2013-05-07T00:54:45Z,PROJECT_STATUS_17723,NULL,12.0,NULL,NULL
Table contains the header information for all CPM projects.,BU50T1_PROJECTS,PROJECT_STATUS,PROJECT_STATUS,compound foreign key to get the project status desc bu50t1_codes,compound foreign key to get the project status desc bu50t1_codes,VARCHAR2,2013-05-07 00:54:47,2013-05-07T00:54:47Z,PROJECT_STATUS_18190,NULL,12.0,NULL,NULL
Table contains the header information for all CPM projects.,BU50T1_PROJECTS,PROJECT_STATUS_CODE_TYPE,PROJECT_STATUS_CODE_TYPE,compound foreign key to bu50t1_codes,compound foreign key to bu50t1_codes,NUMBER,2013-05-07 00:54:47,2013-05-07T00:54:47Z,PROJECT_STATUS_CODE_TYPE_18189,NULL,22.0,NULL,NULL
Contains the attachments data loaded a CPM project.,BU50T1_PROJECT_FILE,PROJ_FILE_SEQ,PROJ_FILE_SEQ,Primary key,Primary key,NUMBER,2013-05-07 00:54:47,2013-05-07T00:54:47Z,PROJ_FILE_SEQ_18218,NULL,22.0,NULL,NULL
Table not used.,BU50T1_PROJ_FUNDING_PROCESSES,PROJ_FND_PROCESS_SEQ,PROJ_FND_PROCESS_SEQ,Primary key,Primary key,NUMBER,2013-05-07 00:54:48,2013-05-07T00:54:48Z,PROJ_FND_PROCESS_SEQ_18498,NULL,22.0,NULL,NULL
Table not used.,BU50T1_PROJ_FUNDING_SOURCES,PROJ_FND_SOURCE_SEQ,PROJ_FND_SOURCE_SEQ,Primary key,Primary key,NUMBER,2013-05-07 00:54:48,2013-05-07T00:54:48Z,PROJ_FND_SOURCE_SEQ_18507,NULL,22.0,NULL,NULL
Table not used.,BU50T1_PROJ_FUNDING_SOURCES,PROJ_FND_STATUS,PROJ_FND_STATUS,Funding status,Funding status,VARCHAR2,2013-05-07 00:54:48,2013-05-07T00:54:48Z,PROJ_FND_STATUS_18509,NULL,500.0,NULL,NULL
All FMPS funding strips associated to a CPM project.,BU50T1_PROJ_FUNDING_STRIPS_JN,PROJ_FUNDING_STRIP_JN_SEQ,PROJ_FUNDING_STRIP_JN_SEQ,Primary key,Primary key,NUMBER,2013-05-07 00:54:48,2013-05-07T00:54:48Z,PROJ_FUNDING_STRIP_JN_SEQ_18537,NULL,22.0,NULL,NULL
FMPS funding strips currently associated to a CPM project.,BU50T1_PROJ_FUNDING_STRIPS,PROJ_FUNDING_STRIP_SEQ,PROJ_FUNDING_STRIP_SEQ,Primary key,Primary key,NUMBER,2013-05-07 00:54:48,2013-05-07T00:54:48Z,PROJ_FUNDING_STRIP_SEQ_18517,NULL,22.0,NULL,NULL
contains the current funding information for a project at the overall project level.,BU50T1_PROJECT_FUNDS,PROJ_FUND_SEQ,PROJ_FUND_SEQ,Primary key,Primary key,NUMBER,2013-05-07 00:54:47,2013-05-07T00:54:47Z,PROJ_FUND_SEQ_18230,NULL,22.0,NULL,NULL
Stores attachments for the projects major task.,BU50T1_PROJECT_MAJOR_TASK_FILE,PROJ_MAJ_TSK_FILE_SEQ,PROJ_MAJ_TSK_FILE_SEQ,Primary key,Primary key,NUMBER,2013-05-07 00:54:48,2013-05-07T00:54:48Z,PROJ_MAJ_TSK_FILE_SEQ_18277,NULL,22.0,NULL,NULL
Stores the major task requisition.,BU50T1_PROJECT_MAJOR_TASK_REQ,PROJ_MAJ_TSK_REQ_SEQ,PROJ_MAJ_TSK_REQ_SEQ,Primary key,Primary key,NUMBER,2013-05-07 00:54:48,2013-05-07T00:54:48Z,PROJ_MAJ_TSK_REQ_SEQ_18289,NULL,22.0,NULL,NULL
Table not used.,BU50T1_PROJECT_REQUISITIONS,PROJ_MAJ_TSK_REQ_SEQ,PROJ_MAJ_TSK_REQ_SEQ,Foreign key to BU50T1_PROJECT_MAJOR_TASK_REQ,Foreign key to BU50T1_PROJECT_MAJOR_TASK_REQ,NUMBER,2013-05-07 00:54:48,2013-05-07T00:54:48Z,PROJ_MAJ_TSK_REQ_SEQ_18432,NULL,22.0,NULL,NULL
Stores the project major tasks.,BU50T1_PROJECT_MAJOR_TASKS,PROJ_MAJ_TSK_SEQ,PROJ_MAJ_TSK_SEQ,Primary key,Primary key,NUMBER,2013-05-07 00:54:47,2013-05-07T00:54:47Z,PROJ_MAJ_TSK_SEQ_18267,NULL,22.0,NULL,NULL
Stores attachments for the projects major task.,BU50T1_PROJECT_MAJOR_TASK_FILE,PROJ_MAJ_TSK_SEQ,PROJ_MAJ_TSK_SEQ,Foreign key to BU50T1_PROJECT_MAJOR_TASKS,Foreign key to BU50T1_PROJECT_MAJOR_TASKS,NUMBER,2013-05-07 00:54:48,2013-05-07T00:54:48Z,PROJ_MAJ_TSK_SEQ_18281,NULL,22.0,NULL,NULL
Stores the major task requisition.,BU50T1_PROJECT_MAJOR_TASK_REQ,PROJ_MAJ_TSK_SEQ,PROJ_MAJ_TSK_SEQ,Foreign key to BU50T1_PROJECT_MAJOR_TASKS,Foreign key to BU50T1_PROJECT_MAJOR_TASKS,NUMBER,2013-05-07 00:54:48,2013-05-07T00:54:48Z,PROJ_MAJ_TSK_SEQ_18290,NULL,22.0,NULL,NULL
Contains the tasks assigned to a project address.,BU50T1_PROJECT_TASKS,PROJ_MAJ_TSK_SEQ,PROJ_MAJ_TSK_SEQ,Foreign key to BU50T1_PROJECT_MAJOR_TASKS,Foreign key to BU50T1_PROJECT_MAJOR_TASKS,NUMBER,2013-05-07 00:54:48,2013-05-07T00:54:48Z,PROJ_MAJ_TSK_SEQ_18455,NULL,22.0,NULL,NULL
Table not used.,BU50T1_PROJ_FUNDING_PROCESSES,PROJ_MAJ_TSK_SEQ,PROJ_MAJ_TSK_SEQ,Foreign key to BU50T1_PROJECT_MAJOR_TASKS,Foreign key to BU50T1_PROJECT_MAJOR_TASKS,NUMBER,2013-05-07 00:54:48,2013-05-07T00:54:48Z,PROJ_MAJ_TSK_SEQ_18499,NULL,22.0,NULL,NULL
Stores the project major task work types.,BU50T1_PROJ_MAJ_TASK_WORK_TYPE,PROJ_MAJ_TSK_SEQ,PROJ_MAJ_TSK_SEQ,Foreign key to BU50T1_PROJECT_MAJOR_TASKS,Foreign key to BU50T1_PROJECT_MAJOR_TASKS,NUMBER,2013-05-07 00:54:49,2013-05-07T00:54:49Z,PROJ_MAJ_TSK_SEQ_18560,NULL,22.0,NULL,NULL
Stores the project major task work types.,BU50T1_PROJ_MAJ_TASK_WORK_TYPE,PROJ_MAJ_TSK_WORK_TYPE_SEQ,PROJ_MAJ_TSK_WORK_TYPE_SEQ,Primary key,Primary key,NUMBER,2013-05-07 00:54:49,2013-05-07T00:54:49Z,PROJ_MAJ_TSK_WORK_TYPE_SEQ_18559,NULL,22.0,NULL,NULL
stores the project manager of the contract,BU50T1_CDOT_CON_PROJ_MANAGERS,PROJ_MANAGER_DN,PROJ_MANAGER_DN,NULL,NULL,VARCHAR2,2013-05-07 00:54:45,2013-05-07T00:54:45Z,PROJ_MANAGER_DN_17655,NULL,250.0,NULL,NULL
Table contains the header information for all CPM projects.,BU50T1_PROJECTS,PROJ_MANAGER_DN,PROJ_MANAGER_DN,LDAP entry. Who is the project manager,LDAP entry. Who is the project manager,VARCHAR2,2013-05-07 00:54:47,2013-05-07T00:54:47Z,PROJ_MANAGER_DN_18182,NULL,250.0,NULL,NULL
Table not used,BU50T1_PROJECT_NOTIFICATIONS,PROJ_MANAGER_DN,PROJ_MANAGER_DN,NULL,NULL,VARCHAR2,2013-05-07 00:54:48,2013-05-07T00:54:48Z,PROJ_MANAGER_DN_18319,NULL,250.0,NULL,NULL
Table contains the header information for all CPM projects.,BU50T1_PROJECTS,PROJ_MANAGER_SEQ,PROJ_MANAGER_SEQ,not used,not used,NUMBER,2013-05-07 00:54:47,2013-05-07T00:54:47Z,PROJ_MANAGER_SEQ_18164,NULL,22.0,NULL,NULL
Current overall notes for the CPM project.,BU50T1_PROJECT_NOTES,PROJ_NOTE_SEQ,PROJ_NOTE_SEQ,Primary key,Primary key,NUMBER,2013-05-07 00:54:48,2013-05-07T00:54:48Z,PROJ_NOTE_SEQ_18298,NULL,22.0,NULL,NULL
stores general CDOT contact information,BU50T1_CDOT_CONTRACTS,PROJ_OR_TASK,PROJ_OR_TASK,compound foreign key to get the orignal task desc from the bu50t1_codes,compound foreign key to get the orignal task desc from the bu50t1_codes,VARCHAR2,2013-05-07 00:54:45,2013-05-07T00:54:45Z,PROJ_OR_TASK_17564,NULL,12.0,NULL,NULL
stores general CDOT contact information,BU50T1_CDOT_CONTRACTS,PROJ_OR_TASK_CODE_TYPE,PROJ_OR_TASK_CODE_TYPE,compound foreign key to bu50t1_codes,compound foreign key to bu50t1_codes,NUMBER,2013-05-07 00:54:45,2013-05-07T00:54:45Z,PROJ_OR_TASK_CODE_TYPE_17563,NULL,22.0,NULL,NULL
legacy table from the CIP system which was replaced by CPM; no longer used in current CPM operations,BU50T1_BENCHMARKS,PROJ_PHASE_CODE,PROJ_PHASE_CODE,compound foreign key to get project phase desc on bu50t1_codes,compound foreign key to get project phase desc on bu50t1_codes,VARCHAR2,2013-05-07 00:54:45,2013-05-07T00:54:45Z,PROJ_PHASE_CODE_17516,NULL,12.0,NULL,NULL
Legacy CIP system work types,BU50T1_CIP_WORK_TYPES,PROJ_PHASE_CODE,PROJ_PHASE_CODE,Not used,Not used,VARCHAR2,2013-05-07 00:54:45,2013-05-07T00:54:45Z,PROJ_PHASE_CODE_17700,NULL,12.0,NULL,NULL
Contains the current CPM project phases for a CPM project.,BU50T1_PROJECT_PHASES,PROJ_PHASE_CODE,PROJ_PHASE_CODE,compound foreign key to get phase desc bu50t1_codes,compound foreign key to get phase desc bu50t1_codes,VARCHAR2,2013-05-07 00:54:48,2013-05-07T00:54:48Z,PROJ_PHASE_CODE_18328,NULL,12.0,NULL,NULL
Contains all the CPM project phases for a CPM project.,BU50T1_PROJECT_PHASE_JN,PROJ_PHASE_CODE,PROJ_PHASE_CODE,compound foreign key to get project phase desc on bu50t1_codes,compound foreign key to get project phase desc on bu50t1_codes,VARCHAR2,2013-05-07 00:54:48,2013-05-07T00:54:48Z,PROJ_PHASE_CODE_18356,NULL,12.0,NULL,NULL
Contains the project phases from the CIP system which was replaced by CPM.,BU50T1_PROJECT_PHASE_LEGACY,PROJ_PHASE_CODE,PROJ_PHASE_CODE,compound foreign key to get project phase desc on bu50t1_codes,compound foreign key to get project phase desc on bu50t1_codes,VARCHAR2,2013-05-07 00:54:48,2013-05-07T00:54:48Z,PROJ_PHASE_CODE_18380,NULL,12.0,NULL,NULL
Contains all the work types listed in CPM.,BU50T1_WORK_TYPES,PROJ_PHASE_CODE,PROJ_PHASE_CODE,compound foreign key to get phase desc on bu50t1_codes,compound foreign key to get phase desc on bu50t1_codes,VARCHAR2,2013-05-07 00:54:49,2013-05-07T00:54:49Z,PROJ_PHASE_CODE_18763,NULL,12.0,NULL,NULL
Used for the conversion of CIP projects to CPM projects.,BU50T1_WORK_TYPES_TEMP,PROJ_PHASE_CODE,PROJ_PHASE_CODE,compound foreign key to get phase desc on bu50t1_codes,compound foreign key to get phase desc on bu50t1_codes,VARCHAR2,2013-05-07 00:54:49,2013-05-07T00:54:49Z,PROJ_PHASE_CODE_18771,NULL,12.0,NULL,NULL
legacy table from the CIP system which was replaced by CPM; no longer used in current CPM operations,BU50T1_BENCHMARKS,PROJ_PHASE_CODE_TYPE,PROJ_PHASE_CODE_TYPE,compound foreign key to bu50t1_codes,compound foreign key to bu50t1_codes,NUMBER,2013-05-07 00:54:45,2013-05-07T00:54:45Z,PROJ_PHASE_CODE_TYPE_17515,NULL,22.0,NULL,NULL
Contains the current CPM project phases for a CPM project.,BU50T1_PROJECT_PHASES,PROJ_PHASE_CODE_TYPE,PROJ_PHASE_CODE_TYPE,compound foreign key to bu50t1_codes,compound foreign key to bu50t1_codes,NUMBER,2013-05-07 00:54:48,2013-05-07T00:54:48Z,PROJ_PHASE_CODE_TYPE_18327,NULL,22.0,102,NULL
Contains all the CPM project phases for a CPM project.,BU50T1_PROJECT_PHASE_JN,PROJ_PHASE_CODE_TYPE,PROJ_PHASE_CODE_TYPE,compound foreign key to bu50t1_codes,compound foreign key to bu50t1_codes,NUMBER,2013-05-07 00:54:48,2013-05-07T00:54:48Z,PROJ_PHASE_CODE_TYPE_18355,NULL,22.0,102,NULL
Contains the project phases from the CIP system which was replaced by CPM.,BU50T1_PROJECT_PHASE_LEGACY,PROJ_PHASE_CODE_TYPE,PROJ_PHASE_CODE_TYPE,compound foreign key to bu50t1_codes,compound foreign key to bu50t1_codes,NUMBER,2013-05-07 00:54:48,2013-05-07T00:54:48Z,PROJ_PHASE_CODE_TYPE_18379,NULL,22.0,102,NULL
Contains all the work types listed in CPM.,BU50T1_WORK_TYPES,PROJ_PHASE_CODE_TYPE,PROJ_PHASE_CODE_TYPE,compound foreign key to bu50t1_codes,compound foreign key to bu50t1_codes,NUMBER,2013-05-07 00:54:49,2013-05-07T00:54:49Z,PROJ_PHASE_CODE_TYPE_18762,NULL,22.0,102,NULL
Used in the CIP system; not used on the CPM system.,BU50T1_PROJ_PHASE_CONTRACTORS,PROJ_PHASE_CON_SEQ,PROJ_PHASE_CON_SEQ,Primary key,Primary key,NUMBER,2013-05-07 00:54:49,2013-05-07T00:54:49Z,PROJ_PHASE_CON_SEQ_18566,NULL,22.0,NULL,NULL
